{
  "protocol_version": "telephone-line-adapter-v1",
  "route_id": "direct-pi",
  "display_name": "Direct PI",
  "windows_entrypoint": "Invoke-DirectPiRoute.ps1",
  "dependency_boundary": "pi-coding-agent-and-node-user-installed",
  "capabilities": {
    "start": true,
    "follow_up": true,
    "recover": true,
    "exact_native_session": true
  }
}
