{
  "protocol_version": "telephone-line-adapter-v1",
  "route_id": "direct-cursor",
  "display_name": "Direct Cursor",
  "windows_entrypoint": "Invoke-DirectCursorRoute.ps1",
  "dependency_boundary": "cursor-agent-cli-user-installed",
  "capabilities": {
    "start": true,
    "follow_up": true,
    "recover": true,
    "exact_native_session": true,
    "partial_session_admission": true
  }
}
