{
  "protocol_version": "telephone-line-adapter-v1",
  "route_id": "direct-codex-cli",
  "display_name": "Direct Codex CLI",
  "windows_entrypoint": "Invoke-DirectCodexCliRoute.ps1",
  "dependency_boundary": "codex-cli-user-installed",
  "capabilities": {
    "start": true,
    "follow_up": true,
    "recover": true,
    "exact_native_session": true
  }
}
